{
  "combo": {
    "id": "binary-framed",
    "protocol": "binary",
    "transport": "framed"
  },
  "dataset_errors": [],
  "messages": [
    {
      "actor": "client",
      "direction": "client->server",
      "envelope": {
        "name": "ping",
        "seqid": 1,
        "span": [
          4,
          20
        ],
        "type": "call"
      },
      "highlights": [],
      "index": 0,
      "message_type": "call",
      "method": "ping",
      "parse_errors": [],
      "payload": {
        "fields": [],
        "span": [
          20,
          21
        ],
        "struct": {
          "name": "args",
          "span": [
            20,
            21
          ],
          "ttype": "struct"
        }
      },
      "raw_hex": "00 00 00 11 80 01 00 01 00 00 00 04 70 69 6e 67 00 00 00 01 00",
      "raw_size": 21,
      "seqid": 1,
      "transport": {
        "frame_header_span": [
          0,
          4
        ],
        "frame_length": 17,
        "payload_span": [
          4,
          21
        ],
        "type": "framed"
      }
    },
    {
      "actor": "server",
      "direction": "server->client",
      "envelope": {
        "name": "ping",
        "seqid": 1,
        "span": [
          4,
          20
        ],
        "type": "reply"
      },
      "highlights": [],
      "index": 1,
      "message_type": "reply",
      "method": "ping",
      "parse_errors": [],
      "payload": {
        "fields": [],
        "span": [
          20,
          21
        ],
        "struct": {
          "name": "args",
          "span": [
            20,
            21
          ],
          "ttype": "struct"
        }
      },
      "raw_hex": "00 00 00 11 80 01 00 02 00 00 00 04 70 69 6e 67 00 00 00 01 00",
      "raw_size": 21,
      "seqid": 1,
      "transport": {
        "frame_header_span": [
          0,
          4
        ],
        "frame_length": 17,
        "payload_span": [
          4,
          21
        ],
        "type": "framed"
      }
    },
    {
      "actor": "client",
      "direction": "client->server",
      "envelope": {
        "name": "add",
        "seqid": 2,
        "span": [
          4,
          19
        ],
        "type": "call"
      },
      "highlights": [],
      "index": 2,
      "message_type": "call",
      "method": "add",
      "parse_errors": [],
      "payload": {
        "fields": [
          {
            "children": [],
            "id": 1,
            "name": "field_1",
            "span": [
              19,
              26
            ],
            "ttype": "i32",
            "value": 1
          },
          {
            "children": [],
            "id": 2,
            "name": "field_2",
            "span": [
              26,
              33
            ],
            "ttype": "i32",
            "value": 1
          }
        ],
        "span": [
          19,
          34
        ],
        "struct": {
          "name": "args",
          "span": [
            19,
            34
          ],
          "ttype": "struct"
        }
      },
      "raw_hex": "00 00 00 1e 80 01 00 01 00 00 00 03 61 64 64 00 00 00 02 08 00 01 00 00 00 01 08 00 02 00 00 00 01 00",
      "raw_size": 34,
      "seqid": 2,
      "transport": {
        "frame_header_span": [
          0,
          4
        ],
        "frame_length": 30,
        "payload_span": [
          4,
          34
        ],
        "type": "framed"
      }
    },
    {
      "actor": "server",
      "direction": "server->client",
      "envelope": {
        "name": "add",
        "seqid": 2,
        "span": [
          4,
          19
        ],
        "type": "reply"
      },
      "highlights": [],
      "index": 3,
      "message_type": "reply",
      "method": "add",
      "parse_errors": [],
      "payload": {
        "fields": [
          {
            "children": [],
            "id": 0,
            "name": "field_0",
            "span": [
              19,
              26
            ],
            "ttype": "i32",
            "value": 2
          }
        ],
        "span": [
          19,
          27
        ],
        "struct": {
          "name": "args",
          "span": [
            19,
            27
          ],
          "ttype": "struct"
        }
      },
      "raw_hex": "00 00 00 17 80 01 00 02 00 00 00 03 61 64 64 00 00 00 02 08 00 00 00 00 00 02 00",
      "raw_size": 27,
      "seqid": 2,
      "transport": {
        "frame_header_span": [
          0,
          4
        ],
        "frame_length": 23,
        "payload_span": [
          4,
          27
        ],
        "type": "framed"
      }
    },
    {
      "actor": "client",
      "direction": "client->server",
      "envelope": {
        "name": "add",
        "seqid": 3,
        "span": [
          4,
          19
        ],
        "type": "call"
      },
      "highlights": [],
      "index": 4,
      "message_type": "call",
      "method": "add",
      "parse_errors": [],
      "payload": {
        "fields": [
          {
            "children": [],
            "id": 1,
            "name": "field_1",
            "span": [
              19,
              26
            ],
            "ttype": "i32",
            "value": 1
          },
          {
            "children": [],
            "id": 2,
            "name": "field_2",
            "span": [
              26,
              33
            ],
            "ttype": "i32",
            "value": 4
          }
        ],
        "span": [
          19,
          34
        ],
        "struct": {
          "name": "args",
          "span": [
            19,
            34
          ],
          "ttype": "struct"
        }
      },
      "raw_hex": "00 00 00 1e 80 01 00 01 00 00 00 03 61 64 64 00 00 00 03 08 00 01 00 00 00 01 08 00 02 00 00 00 04 00",
      "raw_size": 34,
      "seqid": 3,
      "transport": {
        "frame_header_span": [
          0,
          4
        ],
        "frame_length": 30,
        "payload_span": [
          4,
          34
        ],
        "type": "framed"
      }
    },
    {
      "actor": "server",
      "direction": "server->client",
      "envelope": {
        "name": "add",
        "seqid": 3,
        "span": [
          4,
          19
        ],
        "type": "reply"
      },
      "highlights": [],
      "index": 5,
      "message_type": "reply",
      "method": "add",
      "parse_errors": [],
      "payload": {
        "fields": [
          {
            "children": [],
            "id": 0,
            "name": "field_0",
            "span": [
              19,
              26
            ],
            "ttype": "i32",
            "value": 5
          }
        ],
        "span": [
          19,
          27
        ],
        "struct": {
          "name": "args",
          "span": [
            19,
            27
          ],
          "ttype": "struct"
        }
      },
      "raw_hex": "00 00 00 17 80 01 00 02 00 00 00 03 61 64 64 00 00 00 03 08 00 00 00 00 00 05 00",
      "raw_size": 27,
      "seqid": 3,
      "transport": {
        "frame_header_span": [
          0,
          4
        ],
        "frame_length": 23,
        "payload_span": [
          4,
          27
        ],
        "type": "framed"
      }
    },
    {
      "actor": "client",
      "direction": "client->server",
      "envelope": {
        "name": "calculate",
        "seqid": 4,
        "span": [
          4,
          25
        ],
        "type": "call"
      },
      "highlights": [],
      "index": 6,
      "message_type": "call",
      "method": "calculate",
      "parse_errors": [],
      "payload": {
        "fields": [
          {
            "children": [],
            "id": 1,
            "name": "field_1",
            "span": [
              25,
              32
            ],
            "ttype": "i32",
            "value": 1
          },
          {
            "children": [
              {
                "children": [
                  {
                    "children": [],
                    "id": 1,
                    "name": "field_1",
                    "span": [
                      35,
                      42
                    ],
                    "ttype": "i32",
                    "value": 15
                  },
                  {
                    "children": [],
                    "id": 2,
                    "name": "field_2",
                    "span": [
                      42,
                      49
                    ],
                    "ttype": "i32",
                    "value": 10
                  },
                  {
                    "children": [],
                    "id": 3,
                    "name": "field_3",
                    "span": [
                      49,
                      56
                    ],
                    "ttype": "i32",
                    "value": 2
                  }
                ],
                "id": 2,
                "name": "struct",
                "span": [
                  35,
                  57
                ],
                "ttype": "struct",
                "value": null
              }
            ],
            "id": 2,
            "name": "field_2",
            "span": [
              32,
              57
            ],
            "ttype": "struct",
            "value": null
          }
        ],
        "span": [
          25,
          58
        ],
        "struct": {
          "name": "args",
          "span": [
            25,
            58
          ],
          "ttype": "struct"
        }
      },
      "raw_hex": "00 00 00 36 80 01 00 01 00 00 00 09 63 61 6c 63 75 6c 61 74 65 00 00 00 04 08 00 01 00 00 00 01 0c 00 02 08 00 01 00 00 00 0f 08 00 02 00 00 00 0a 08 00 03 00 00 00 02 00 00",
      "raw_size": 58,
      "seqid": 4,
      "transport": {
        "frame_header_span": [
          0,
          4
        ],
        "frame_length": 54,
        "payload_span": [
          4,